[
  {
    "id": "general-store",
    "name": "General Store",
    "icon": "icons/svg/item-bag.svg",
    "sort": 0,
    "categories": [
      "containers",
      "fire-lighting",
      "rope-climbing",
      "camping",
      "writing",
      "household",
      "animal",
      "travel",
      "tools",
      "trade-goods",
      "alchemical-goods",
      "clothing",
      "spellcasting-supplies"
    ],
    "fallbackCategory": {
      "id": "other",
      "name": "Other goods",
      "icon": "icons/svg/item-bag.svg"
    },
    "metadata": {}
  },
  {
    "id": "tavern",
    "name": "Tavern",
    "icon": "icons/consumables/drinks/alcohol-beer-stein-wooden-brown.webp",
    "sort": 10,
    "categories": [
      "ale",
      "beer",
      "mead",
      "wine",
      "spirits",
      "non-alcoholic-drinks",
      "hot-drinks",
      "breakfast",
      "lunch",
      "dinner",
      "stews",
      "roasts",
      "bread",
      "cheese",
      "desserts",
      "snacks",
      "travel-meals",
      "luxury-meals",
      "animal-feed",
      "animal",
      "camping",
      "containers",
      "fire-lighting",
      "household",
      "rope-climbing",
      "travel",
      "imported-drinks",
      "soups",
      "fish",
      "tavern-supplies"
    ],
    "fallbackCategory": {
      "id": "other",
      "name": "Other goods",
      "icon": "icons/svg/item-bag.svg"
    },
    "metadata": {
      "defaultServiceCategories": [
        "tavern-accommodation",
        "tavern-food-service",
        "tavern-stable",
        "tavern-facilities",
        "tavern-hospitality",
        "tavern-premium"
      ]
    }
  },
  {
    "id": "alchemist",
    "name": "Alchemist",
    "icon": "icons/svg/item-bag.svg",
    "sort": 20,
    "categories": [
      "containers",
      "fire-lighting",
      "writing",
      "potions",
      "herbs",
      "ingredients",
      "reagents",
      "glassware",
      "alchemical-tools",
      "tools",
      "alchemical-goods",
      "spellcasting-supplies"
    ],
    "fallbackCategory": {
      "id": "other",
      "name": "Other goods",
      "icon": "icons/svg/item-bag.svg"
    },
    "metadata": {}
  },
  {
    "id": "blacksmith",
    "name": "Blacksmith",
    "icon": "icons/skills/trades/smithing-tongs-metal-red.webp",
    "sort": 30,
    "categories": [
      "simple-weapons",
      "martial-weapons",
      "light-armour",
      "medium-armour",
      "heavy-armour",
      "shields",
      "tools",
      "ammunition",
      "trade-goods",
      "containers",
      "fire-lighting",
      "rope-climbing",
      "animal"
    ],
    "fallbackCategory": {
      "id": "other",
      "name": "Other goods",
      "icon": "icons/svg/item-bag.svg"
    },
    "metadata": {
      "defaultServiceCategories": [
        "smith-repairs",
        "smith-fitting",
        "smith-specialist"
      ]
    }
  },
  {
    "id": "black-market",
    "name": "Fence",
    "icon": "icons/svg/item-bag.svg",
    "sort": 40,
    "categories": [
      "containers",
      "rope-climbing",
      "writing",
      "travel",
      "tools",
      "martial-weapons",
      "simple-weapons",
      "reagents",
      "disguises",
      "forgery",
      "burglary-tools",
      "poisons",
      "smuggling",
      "contraband",
      "stolen-goods",
      "curiosities",
      "rare-components",
      "trade-goods"
    ],
    "fallbackCategory": {
      "id": "other",
      "name": "Other goods",
      "icon": "icons/svg/item-bag.svg"
    },
    "metadata": {
      "aliases": [
        "Black Market Dealer",
        "Smuggler",
        "Underground Trader"
      ],
      "defaultServiceCategories": [
        "fence-trade",
        "fence-logistics",
        "fence-specialist"
      ]
    }
  }
]
